{
  "time_utc": [
    "2026-11-01T00:00:00Z",
    "2026-11-01T04:00:00Z",
    "2026-11-01T08:00:00Z",
    "2026-11-01T12:00:00Z",
    "2026-11-01T16:00:00Z",
    "2026-11-01T20:00:00Z",
    "2026-11-02T00:00:00Z",
    "2026-11-02T04:00:00Z",
    "2026-11-02T08:00:00Z",
    "2026-11-02T12:00:00Z",
    "2026-11-02T16:00:00Z",
    "2026-11-02T20:00:00Z"
  ],
  "sun": {
    "az_deg": [
      0,
      8,
      16,
      24,
      32,
      40,
      48,
      56,
      64,
      72,
      80,
      88
    ],
    "el_deg": [
      1.4,
      1.52,
      1.62,
      1.68,
      1.7,
      1.67,
      1.6,
      1.5,
      1.38,
      1.27,
      1.17,
      1.11
    ],
    "radius_deg": [
      0.265,
      0.265,
      0.265,
      0.265,
      0.265,
      0.265,
      0.265,
      0.265,
      0.265,
      0.265,
      0.265,
      0.265
    ],
    "frac": [
      0.35,
      0.52,
      0.63,
      0.64,
      0.55,
      0.39,
      0.22,
      0.09,
      0.05,
      0.12,
      0.27,
      0.44
    ],
    "status": [
      "marginal",
      "robust_visible",
      "robust_visible",
      "robust_visible",
      "robust_visible",
      "marginal",
      "marginal",
      "robust_blocked",
      "robust_blocked",
      "marginal",
      "marginal",
      "marginal"
    ]
  },
  "earth": {
    "az_deg": [
      270,
      270.9,
      271.7,
      272.3,
      272.8,
      273,
      272.9,
      272.6,
      272,
      271.3,
      270.4,
      269.5
    ],
    "el_deg": [
      6.7,
      6.63,
      6.44,
      6.13,
      5.74,
      5.31,
      4.86,
      4.44,
      4.09,
      3.84,
      3.72,
      3.72
    ],
    "radius_deg": [
      0.95,
      0.95,
      0.95,
      0.95,
      0.95,
      0.95,
      0.95,
      0.95,
      0.95,
      0.95,
      0.95,
      0.95
    ],
    "frac": [
      0.7,
      0.72,
      0.74,
      0.76,
      0.77,
      0.78,
      0.79,
      0.8,
      0.8,
      0.8,
      0.79,
      0.78
    ],
    "status": [
      "robust_visible",
      "robust_visible",
      "robust_visible",
      "robust_visible",
      "robust_visible",
      "robust_visible",
      "robust_visible",
      "robust_visible",
      "robust_visible",
      "robust_visible",
      "robust_visible",
      "robust_visible"
    ],
    "dist_km": [
      384400,
      384400,
      384400,
      384400,
      384400,
      384400,
      384400,
      384400,
      384400,
      384400,
      384400,
      384400
    ]
  },
  "dte": {
    "station_names": [
      "Goldstone (DSS 14/25)",
      "Madrid (DSS 63/65)",
      "Canberra (DSS 43/34)"
    ],
    "station_visible": [
      [
        true,
        false,
        true
      ],
      [
        true,
        true,
        false
      ],
      [
        false,
        true,
        true
      ],
      [
        true,
        false,
        true
      ],
      [
        true,
        true,
        false
      ],
      [
        false,
        true,
        true
      ],
      [
        true,
        false,
        true
      ],
      [
        true,
        true,
        false
      ],
      [
        false,
        true,
        true
      ],
      [
        true,
        false,
        true
      ],
      [
        true,
        true,
        false
      ],
      [
        false,
        true,
        true
      ]
    ],
    "link_ok": [
      true,
      true,
      true,
      true,
      true,
      true,
      true,
      true,
      true,
      true,
      true,
      true
    ]
  }
}